{
  "schemaVersion": "1.0",
  "analysisId": "sha256:638bf67049dddfb506455c6c5eb9102135fea5bc4f7ca95aa969ae8858b538c1",
  "providerId": "microsoft-fast",
  "snapshotId": "sha256:5a59214ec84f70e0bc8f1da052458233ed2eab0f8c7963e6c92b66142e45bd69",
  "scenarioSlug": "fast-006-fraud-investigation-fully-custom",
  "status": "evaluated",
  "sourceState": "available",
  "evaluatedAtUtc": "2026-10-16T12:00:00.0000000Z",
  "requirementsHash": "d6c3455f82de283a6a6677f0d3787be9d912899a57b5bad511e8a40bb7f9f783",
  "requirements": [
    {
      "requirementId": "REQ-EVIDENCE-CUSTODY-001",
      "scenarioSlug": "fast-006-fraud-investigation-fully-custom",
      "statement": "evidence custody",
      "acceptanceCriteria": [
        "An investigator completes a synthetic fraud case with traceable custody"
      ],
      "actors": [
        "compliance reviewers",
        "evidence custodians",
        "Fraud investigators",
        "supervisors"
      ],
      "entities": [
        "Evidence",
        "Evidence Custody Event"
      ],
      "integrations": [
        "active investigation and custody views",
        "and management reports Investigator | triage intake and assign investigator | per intake | fiv_investigation/Active Investigations | owner and priority are recorded",
        "and operational and management reporting Intake and assignment forms",
        "evidence custody",
        "external fraud-scoring integration",
        "interview timeline",
        "interviews",
        "investigator assignment",
        "Manage investigation intake",
        "operational dashboard",
        "supervisor approval",
        "supervisor approval workflow"
      ],
      "requiredCapabilities": [],
      "priority": "unspecified",
      "uncertainties": [],
      "normalizedTerms": [
        "case",
        "completes",
        "custody",
        "evidence",
        "fraud",
        "investigator",
        "synthetic",
        "traceable"
      ]
    },
    {
      "requirementId": "REQ-EXTERNAL-FRAUD-SCORING-INTEGRATION-001",
      "scenarioSlug": "fast-006-fraud-investigation-fully-custom",
      "statement": "external fraud-scoring integration",
      "acceptanceCriteria": [
        "an externally sourced fraud score and audit reference",
        "An investigator completes a synthetic fraud case with traceable custody"
      ],
      "actors": [
        "compliance reviewers",
        "evidence custodians",
        "Fraud investigators",
        "supervisors"
      ],
      "entities": [
        "Fraud Score"
      ],
      "integrations": [
        "active investigation and custody views",
        "and management reports Investigator | triage intake and assign investigator | per intake | fiv_investigation/Active Investigations | owner and priority are recorded",
        "and operational and management reporting Intake and assignment forms",
        "evidence custody",
        "external fraud-scoring integration",
        "interview timeline",
        "interviews",
        "investigator assignment",
        "Manage investigation intake",
        "operational dashboard",
        "supervisor approval",
        "supervisor approval workflow"
      ],
      "requiredCapabilities": [],
      "priority": "unspecified",
      "uncertainties": [],
      "normalizedTerms": [
        "external",
        "fraud",
        "integration",
        "object",
        "scoring"
      ]
    },
    {
      "requirementId": "REQ-INTERVIEW-001",
      "scenarioSlug": "fast-006-fraud-investigation-fully-custom",
      "statement": "interviews",
      "acceptanceCriteria": [
        "interview history"
      ],
      "actors": [
        "compliance reviewers",
        "evidence custodians",
        "Fraud investigators",
        "supervisors"
      ],
      "entities": [
        "Interview"
      ],
      "integrations": [
        "active investigation and custody views",
        "and management reports Investigator | triage intake and assign investigator | per intake | fiv_investigation/Active Investigations | owner and priority are recorded",
        "and operational and management reporting Intake and assignment forms",
        "evidence custody",
        "external fraud-scoring integration",
        "interview timeline",
        "interviews",
        "investigator assignment",
        "Manage investigation intake",
        "operational dashboard",
        "supervisor approval",
        "supervisor approval workflow"
      ],
      "requiredCapabilities": [],
      "priority": "unspecified",
      "uncertainties": [],
      "normalizedTerms": [
        "history",
        "interview",
        "interviews"
      ]
    },
    {
      "requirementId": "REQ-INVESTIGATION-INTAKE-001",
      "scenarioSlug": "fast-006-fraud-investigation-fully-custom",
      "statement": "Manage investigation intake",
      "acceptanceCriteria": [
        "An investigator completes a synthetic fraud case with traceable custody"
      ],
      "actors": [
        "compliance reviewers",
        "evidence custodians",
        "Fraud investigators",
        "supervisors"
      ],
      "entities": [
        "Investigation",
        "Investigator Assignment"
      ],
      "integrations": [
        "active investigation and custody views",
        "and management reports Investigator | triage intake and assign investigator | per intake | fiv_investigation/Active Investigations | owner and priority are recorded",
        "and operational and management reporting Intake and assignment forms",
        "evidence custody",
        "external fraud-scoring integration",
        "interview timeline",
        "interviews",
        "investigator assignment",
        "Manage investigation intake",
        "operational dashboard",
        "supervisor approval",
        "supervisor approval workflow"
      ],
      "requiredCapabilities": [],
      "priority": "unspecified",
      "uncertainties": [],
      "normalizedTerms": [
        "case",
        "completes",
        "custody",
        "fraud",
        "intake",
        "investigation",
        "investigator",
        "synthetic",
        "traceable"
      ]
    },
    {
      "requirementId": "REQ-INVESTIGATOR-ASSIGNMENT-001",
      "scenarioSlug": "fast-006-fraud-investigation-fully-custom",
      "statement": "investigator assignment",
      "acceptanceCriteria": [
        "An investigator completes a synthetic fraud case with traceable custody"
      ],
      "actors": [
        "compliance reviewers",
        "evidence custodians",
        "Fraud investigators",
        "supervisors"
      ],
      "entities": [
        "Investigation",
        "Investigator Assignment"
      ],
      "integrations": [
        "active investigation and custody views",
        "and management reports Investigator | triage intake and assign investigator | per intake | fiv_investigation/Active Investigations | owner and priority are recorded",
        "and operational and management reporting Intake and assignment forms",
        "evidence custody",
        "external fraud-scoring integration",
        "interview timeline",
        "interviews",
        "investigator assignment",
        "Manage investigation intake",
        "operational dashboard",
        "supervisor approval",
        "supervisor approval workflow"
      ],
      "requiredCapabilities": [],
      "priority": "unspecified",
      "uncertainties": [],
      "normalizedTerms": [
        "assignment",
        "case",
        "completes",
        "custody",
        "fraud",
        "investigator",
        "synthetic",
        "traceable"
      ]
    },
    {
      "requirementId": "REQ-OPERATIONAL-AND-MANAGEMENT-REPORTING-001",
      "scenarioSlug": "fast-006-fraud-investigation-fully-custom",
      "statement": "operational and management reporting",
      "acceptanceCriteria": [
        "accurate reporting"
      ],
      "actors": [
        "compliance reviewers",
        "evidence custodians",
        "Fraud investigators",
        "supervisors"
      ],
      "entities": [
        "Report"
      ],
      "integrations": [
        "active investigation and custody views",
        "and management reports Investigator | triage intake and assign investigator | per intake | fiv_investigation/Active Investigations | owner and priority are recorded",
        "and operational and management reporting Intake and assignment forms",
        "evidence custody",
        "external fraud-scoring integration",
        "interview timeline",
        "interviews",
        "investigator assignment",
        "Manage investigation intake",
        "operational dashboard",
        "supervisor approval",
        "supervisor approval workflow"
      ],
      "requiredCapabilities": [],
      "priority": "unspecified",
      "uncertainties": [],
      "normalizedTerms": [
        "accurate",
        "operational",
        "reporting"
      ]
    },
    {
      "requirementId": "REQ-SUPERVISOR-APPROVAL-001",
      "scenarioSlug": "fast-006-fraud-investigation-fully-custom",
      "statement": "supervisor approval",
      "acceptanceCriteria": [
        "supervisor approval"
      ],
      "actors": [
        "compliance reviewers",
        "evidence custodians",
        "Fraud investigators",
        "supervisors"
      ],
      "entities": [
        "Supervisor Approval"
      ],
      "integrations": [
        "active investigation and custody views",
        "and management reports Investigator | triage intake and assign investigator | per intake | fiv_investigation/Active Investigations | owner and priority are recorded",
        "and operational and management reporting Intake and assignment forms",
        "evidence custody",
        "external fraud-scoring integration",
        "interview timeline",
        "interviews",
        "investigator assignment",
        "Manage investigation intake",
        "operational dashboard",
        "supervisor approval",
        "supervisor approval workflow"